Mapa da patologia,"Telhado: Fazer a limpeza da caixa, trocar a claraboia para evitar entrada de bichos e recompor estrutura de madeira de contraventamento."
Solução recomendada,"Revestimento: Pisos soltos, sem rejunte e tampa de reservatório danificada."
Mapa da patologia,"Revestimento: Fazer a recolocação de pisos quebrados e soltos, aplicar rejunte e fazer o fechamento e selagem de tampa de reservatório infeiror."
Solução recomendada,Estrutura: Ferragens expostas.
Mapa da patologia,"Estrutura: Fazer o tratamento de ferragens expostas em tampa de concreto, analisando o teor de cloretos, conforme anexo."
Solução recomendada,Elétrica bomba: Fiações expostas e sem automação.
Mapa da patologia,"Elétrica bomba: Fazer a instalação de tubulações e/ou canaletas, para isolamento de fiação e recomendo, fazer a automação para a alternância de bombas."
Solução recomendada,Parede: Peitoril com altura inferior a NBR 9050 e legislação do corpo de bombeiros.
Mapa da patologia,Parede: Fazer o complemento de guarda corpo em metal ou alvenaria.
Solução recomendada,"Incêndio: Ausência de corrimão na escadaria, sinalização rota de fuga em desconformidade, sem fita antiderrapante."
Mapa da patologia,"Incêndio: Instalar corrimão no lado oposto da escadaria, colocar placas de sinalização rota de fuga, escadaria em leque, setas de rodapé, instalar fita antiderrapante nas escadarias em leque."
Solução recomendada,Elétrica: Ausência de acabamentos elétricos.
Mapa da patologia,Elétrica: Instalar placas de tomadas.
Solução recomendada,"Incêndio: Ausência de corrimão na escadaria, sinalização rota de fuga em desconformidade, sem fita antiderrapante."
Mapa da patologia,"Incêndio: Instalar corrimão no lado oposto da escadaria, colocar placas de sinalização rota de fuga, escadaria em leque, setas de rodapé, instalar fita antiderrapante nas escadarias em leque."
Solução recomendada,"Viga: Fissuras, trincas em viga."
Mapa da patologia,"Viga: Fazer a verificação de fissuras, trincas em viga e tratar, conforme anexo"
Solução recomendada,Toldo: Toldo deformado.
Mapa da patologia,Toldo: Fazer a troca de placas e/ou troca do toldo.
Solução recomendada,Revestimento: Pastilhas danificadas e pintura com mapeamento.
Mapa da patologia,Laje: falta de limpeza e limosidade ocasionando degradação de impermeabilização 
Solução recomendada,"Laje: Implementar um programa regular de limpeza e manutenção para prevenir a 
acumulação de sujeira e limosidade, preservando assim a integridade da 
impermeabilização e verificar prazo de validade da impermeabilização "
Mapa da patologia,Armazém: presença de oxidação e ferrugem em estrutura metálica
Solução recomendada,Armazém: Aplicar tratamento antiferrugem e investigar causa do problema
Mapa da patologia,Forro operação: Infiltração no forro devido a falhas na impermeabilização.
Solução recomendada,Forro operação: Reparo das áreas danificadas e aplicação de sistema de impermeabilização adequado.
Mapa da patologia,Forro operação: Infiltração no forro devido a falhas na impermeabilização e acúmulo de agua na laje
Solução recomendada,Forro operação: Reparo das áreas danificadas e aplicação de sistema de impermeabilização adequado.
Mapa da patologia,Teto: Rachaduras no teto possivelmente à infiltração de água da chuva.
Solução recomendada,Teto: Reparo das rachaduras e correção das áreas danificadas na cobertura para evitar infiltrações.
Mapa da patologia,Teto: Manchas amareladas de infiltração no teto devido à umidade.
Solução recomendada,Teto: Tratamento da área afetada para eliminar a umidade e aplicação de pintura acrílica.
Mapa da patologia,Laje: Acúmulo de água parada sobre a laje devido a falta de drenagem adequada.
Solução recomendada,Laje: Implementação de sistema de drenagem para direcionar a água para fora da laje para evitar o acúmulo de água
Mapa da patologia,Forro: Manchas de infiltração no forro devido a vazamentos ou falhas na impermeabilização.
Solução recomendada,"Forro: Identificação e reparo das áreas com vazamentos, seguido pela aplicação de um sistema de impermeabilização adequado para evitar futuras infiltrações."
Mapa da patologia,Teto: infiltração no teto acima do forro devido à infiltração de água da chuva.
Solução recomendada,Teto: Reparo das áreas danificadas na cobertura para evitar infiltrações.
Mapa da patologia,Portas: Fissuras em portas
Solução recomendada,"Portas: Fazer a verificação de atividade das Fissuras, conforme anexo após verificação, prosseguir com o tratamento necessário."
Mapa da patologia,Revestimento: Fissuras em parede de darywall
Solução recomendada,Revestimento: Fazer o tratamento das juntas do draywall.
Mapa da patologia,Pista de acesso de autos: pista de acesso de autos esburacada
Solução recomendada,"Pista de acesso de autos: Substituição de trechos de concreto danificados na pista, com comprimento de até um metro por toda a largura da via. Esse processo será repetido em todos os locais que apresentarem problemas"
Mapa da patologia,calha: rachaduras e fissuras
Solução recomendada,calha: limpar e preencher as rachaduras com selantes polimérico e aplicar uma camada impermeabilizante para prevenir futuras infiltrações.
Mapa da patologia,Parede lateral: fissuras e rachaduras
Solução recomendada,Parede lateral : limpar e preencher as rachaduras com selantes polimérico e aplicar uma camada impermeabilizante para prevenir futuras infiltrações..
Mapa da patologia,Tubulação: tubulação danifica e com plantas crescendo em volta.
Solução recomendada,Tubulação :efetuar troca de parte da tubulação danifica e remoção e limpeza da área em volta
Mapa da patologia,Parede fundos: fissuras e infiltração e pintura descascando e desplacamento de revestimento
Solução recomendada,Parede fundos: muro de divisão: limpar e preencher as fissuras com selantes polimérico e aplicar uma camada impermeabilizante para prevenir futuras infiltrações e aplicar nova pintura remover placas de revestimento e fazer aplicação de nova camada de revestimento em área danificada.
Mapa da patologia,Laje do gás : sem proteção na parte superior
Solução recomendada,Laje do gás: fazer telhado ou proteção de rufo encima da laje do gás
Mapa da patologia,Paredes: desplacamento de revestimento
Solução recomendada,Paredes: remover placas de revestimento e fazer aplicação de nova camada de revestimento em área danificada.
Mapa da patologia,muro de divisão : fissuras e infiltração e pintura descascando e muro de divisão inclinado
Solução recomendada,muro de divisão: limpar e preencher as fissuras com argamassa apropriada e aplicar uma camada impermeabilizante para prevenir futuras infiltrações e aplicar nova pintura .fazer acompanhamento de inclinação de muro se é passivo ou ativo
Mapa da patologia,"Telhas: telhas levantadas podem resultar em infiltrações de água, comprometendo a estrutura e a integridade da construção"
Solução recomendada,"Telhas: recolocar ou substituir as telhas afetadas, garantindo sua fixação correta e vedação adequada para prevenir infiltrações."
Mapa da patologia,Ripa: rachadura na ripa comprometendo a estabilidade das telhas
Solução recomendada,Ripa: substituir a ripa rachada
Mapa da patologia,"Caixa d’ água: caixa d'água de amianto com sujeira representa um grave risco à saúde. O amianto, material altamente perigoso, pode liberar fibras nocivas quando deteriorado, contaminando a água e sendo inalado ou ingerido, aumentando o risco de doenças respiratórias e câncer"
Solução recomendada,"Caixa d’ água:  substituir a caixa de amianto por uma de material seguro, como fibra de 
vidro ou plástico, garantindo limpeza regular e manutenção adequada para evitar 
contaminação. "
Mapa da patologia,rede de drenagem: Verificação de raízes das plantas do jardim danificando tubulação .
Solução recomendada,rede de drenagem: : efetuar remoção de raízes e identificar plantas que estão comprometendo rede de drenagem para remoção
Mapa da patologia,"Muro de divisa: A tinta não foi aplicada de maneira uniforme, resultando em áreas mais escuras ou mais claras."
Solução recomendada,"Muro de divisa: : Para corrigir a aplicação desigual da tinta, lixe suavemente a superfície para remover imperfeições, misture bem a tinta e aplique camadas adicionais de forma uniforme, utilizando rolos e pincéis de boa qualidade, mantendo uma borda úmida e esperando o tempo de secagem adequado entre as camadas."
Mapa da patologia,"Escada marinheiro: Ausência de aterramento da escada e presença de matos em 
impermeabilização. "
Solução recomendada,"Escada marinheiro: Realizar o aterramento adequado da escada marinheiro conforme 
as normas técnicas. Remover os matos da área impermeabilizada e refazer a 
impermeabilização, pontiualmente. "
Mapa da patologia,Para-raios: Luz piloto queimada.
Solução recomendada,Para-raios: Substituir a luz piloto queimada no para-raios.
Mapa da patologia,Tampa caixa d’água: Tampa em concreto quebrada.
Solução recomendada,Tampa caixa d’água: Trocar tampas de concreto para alumínio.
Mapa da patologia,Incêndio: Ausência porta corta fogo e porta com sentido invertido de saída. Ausência de guarda corpo em saída de casa de máquinas e identificação de prumadas das tubulações.
Solução recomendada,"Incêndio: instalar porta corta-fogo e corrigir o sentido da porta existente para facilitar a 
saída instalar guarda-corpo adequado na saída da casa de máquinas. Identificar as 
prumadas das tubulações de forma visível e conforme as normas."
Mapa da patologia,"Elétrica: Troca de chave seccionadora, por disjuntor caixa moldada e instalação de tampa do quadro."
Solução recomendada,Elétrica: Substituir a chave seccionadora por disjuntor caixa moldada e instalar uma tampa apropriada no quadro elétrico.
Mapa da patologia,Lixeira antiga: Ausência de fechadura em shaft.
Solução recomendada,Lixeira antiga: Instalar fechaduras nos shafts.
Mapa da patologia,Elétrica: Shaft sem trancas e com fiação exposta.
Solução recomendada,Elétrica: Corrigir a exposição da fiação nos shafts e garantir que estejam trancados.
Mapa da patologia,"Incêndio: Falta de guarda corpo de proteção contra quedas. Ausência de corrimão no lado oposto da escadaria. Instalação de fita antiderrapante em escada em leque. Objetos “lixeira”, obstruindo rota de fuga."
Solução recomendada,"Incêndio: Instalar guarda-corpo e corrimão no lado oposto da escadaria. 
Colocar fita antiderrapante nas escadas em leque. Trancar a lixeira para não obstruir 
a rota de fuga e manter a compartimentação vertical. "
Mapa da patologia,Teto: Infiltração no teto com possível corrosão de armadura.
Solução recomendada,Teto: Corrigir a infiltração no teto e realizar tratamento anticorrosivo na armadura
Mapa da patologia,"Parede: Infiltração por falta de rufo e/ou canaleta, causando escorrimento em parede e envelhecimento da tinta."
Solução recomendada,Parede: Instalar rufo e/ou canaleta nas áreas necessárias para evitar infiltrações nas paredes.
Mapa da patologia,Piso: rachaduras e fissuras devido à falta de aderência adequada entre o revestimento e o substrato ou ao deslocamento da estrutura subjacente. .
Solução recomendada,"Piso: Reparar as rachaduras e fissuras no piso, garantindo a adesão adequada entre o revestimento e o substrato."
Mapa da patologia,Pilar e viga: Fissuras e trincas em vigas e laje na garagem do térreo
Solução recomendada,"Pilar e viga: Reparar as fissuras e trincas nas vigas e lajes, aplicando reforço estrutural, conforme anexo."
Mapa da patologia,"Para-raios: Laudo de SPDA, fora da norma NBR5419, onde é recomendado a medição de continuidade."
Solução recomendada,Para-raios: Realizar nova medição de continuidade do SPDA e atualizar o laudo conforme a norma NBR5419.
Mapa da patologia,Elétrica: Disjuntor unipolar em circuito 220V e fiação exposta em caixa de passagem sem trancas
Solução recomendada,Elétrica: Substituir o disjuntor unipolar por um dispositivo adequado para circuito 220V e corrigir a exposição da fiação na caixa de passagem.
Mapa da patologia,Elétrica fiação exposta em caixa de passagem sem fechamento. Fiações expostas em fachada do imóvel.
Solução recomendada,"Elétrica Corrigir a exposição da fiação na caixa de passagem e na fachada, garantindo a proteção adequada."
Mapa da patologia,Elétrica: Disjuntor unipolar em circuito 220V e chave com fusível.
Solução recomendada,Elétrica: Substituir o disjuntor unipolar por um dispositivo adequado para circuito 220V.
Mapa da patologia,"Piso: Caixa de passagem aberta, sem proteção."
Solução recomendada,Piso: Fechar a caixa de passagem e garantir a proteção adequada.
Mapa da patologia,Fissuras em paredes e desplacamento de revestimentos e envelhecimento da pintura.
Solução recomendada,"Realizar o reparo das fissuras nas paredes, refazer o revestimento e pintar novamente as áreas afetadas."
Mapa da patologia,Fachada: Presença de matos e possíveis desplacamentos de revestimentos.
Solução recomendada,"Fachada: Remover os matos e verificar os possíveis desplacamentos de revestimentos, corrigindo-os."
Mapa da patologia,Incêndio: Ausência de placa de sinalização de registro de recalque e caixa de registro de recalque na calçada obsoleta.
Solução recomendada,Incêndio: Instalar placa de sinalização de registro de recalque e remover a caixa de registro de recalque na calçada.
Mapa da patologia,Elétrica: Fiação exposta sem proteção e caixa de passagem elétrica obstruída.
Solução recomendada,"Elétrica: Corrigir a exposição da fiação, garantindo a proteção adequada. 
Desobstruir e corrigir a caixa de passagem elétrica. "
Mapa da patologia,"Telhado Cobertura:  Telhas quebradas e possível presença de pombos, dentro do telhado. "
Solução recomendada,"Telhado Cobertura: Substituir as telhas danificadas e vedar as aberturas nas telhas. Utilize 
métodos de dissuasão, como dispositivos repelentes, para controlar a presença das aves 
de forma segura"
Mapa da patologia,"RESERVATÓRIO: Ferragens expostas, impermeabilização antiga e água suja."
Solução recomendada,"RESERVATÓRIO: Realizar a substituição ou reparo das ferragens conforme anexo, aplicando uma nova camada de impermeabilização adequada. A impermeabilização deve ser feita com materiais de qualidade, como mantas ou resinas, para evitar infiltrações futuras. Além disso, é fundamental limpar e substituir a água contaminada, garantindo o bom funcionamento do sistema de drenagem e o controle da qualidade da água."
Mapa da patologia,"INCÊNDIO: Hidrantes trancados com cadeado, escada sem corrimão em ambos os lados e complemento no patamar e ausência de sinalização de rota de fuga."
Solução recomendada,"INCÊNDIO: Remover os cadeados dos hidrantes, garantindo acesso livre e imediato em caso de emergência. Instalar corrimão em ambos os lados da escada para segurança, além de complementar o patamar conforme as normas. A sinalização de rotas de fuga deve ser instalada de forma clara e visível, conforme as normas de segurança, para garantir a evacuação rápida e segura."
Mapa da patologia,ESTRUTURA: Fissura em parede junto ao interruptor elétrico.
Solução recomendada,ESTRUTURA: A fissura na parede próxima ao interruptor elétrico deve ser reparada conforme anexo.
Mapa da patologia,INCÊNDIO: Escada sem corrimão em ambos os lados e complemento no patamar e ausência de sinalização de rota de fuga.
Solução recomendada,"INCÊNDIO: Instalar corrimãos adequados de acordo com as normas de segurança, garantindo acessibilidade e proteção aos usuários. O patamar também deve ser complementado para melhorar a circulação. Implementar placas visíveis, com material refletivo, para garantir a segurança em emergências."
Mapa da patologia,"INFILTRAÇÃO: Parede com infiltração do apartamento, com presença de umidade."
Solução recomendada,"INFILTRAÇÃO: A infiltração na parede deve ser tratada com a identificação da origem da umidade, seguido de reparo nas tubulações ou revestimentos, além de a aplicação de selantes impermeabilizantes para evitar novos danos."
Mapa da patologia,"ESTRUTURA: Desplacamento revestimento do concreto, com corrosão das armaduras."
Solução recomendada,"ESTRUTURA: A corrosão das armaduras deve ser tratada com a remoção do concreto danificado, limpeza das armaduras expostas para remover ferrugem e aplicação de um produto anticorrosivo. Após isso, a recomposição do revestimento deve ser feita com concreto de alta qualidade e, se necessário, com aditivos impermeabilizantes, para garantir a durabilidade e a integridade estrutural"
Mapa da patologia,PINTURA: Envelhecimento precoce de revestimento e falta de manutenção da pintura.
Solução recomendada,"PINTURA: Realizar uma limpeza profunda das superfícies afetadas para remover sujeira, mofo ou outras impurezas. Em seguida, é recomendado reparar fissuras ou desgastes no revestimento, aplicando massa corrida ou produtos específicos para restaurar a superfície. A pintura deve ser refeita com tintas de boa qualidade, adequadas ao tipo de ambiente (externo ou interno), e sempre de acordo com as condições climáticas e de umidade locais."
Mapa da patologia,"INCÊNDIO: Escada sem corrimão em ambos os lados e complemento no patamar e ausência de sinalização de rota de fuga, ausência de adaptador, esguicho e chave Storz."
Solução recomendada,"INCÊNDIO: Instalar corrimãos adequados em conformidade com as normas de segurança 
e acessibilidade, também complementando o patamar para garantir circulação segura. 
Instalação de placas fotoluminescentes, nas rotas de evacuação em caso de emergência. 
Aquisição e instalação esguichos, adaptadores e chave Storz para que o sistema de 
combate a incêndios esteja completo e funcional. "
Mapa da patologia,ELÉTRICA: Disjuntores unipolar em circuito 220V tipo NEMA. Luminárias penduras soltas.
Solução recomendada,"ELÉTRICA: Substituir disjuntores, adequados à norma técnica vigente, preferencialmente bipolares, para garantir maior segurança e proteção contra sobrecargas e curto circuitos. Revisar quadro de distribuição, adaptando-o ao padrão atual dimensionado corretamente para as necessidades do sistema elétrico. Fixar luminárias, prevenindo riscos de quedas e curtos-circuitos."
Mapa da patologia,"PISO: Placas de pisos quebradas e sem rejuntes, desgastadas com as intempéries "
Solução recomendada,"PISO: Substituir e/ou repara placas de piso para garantir a segurança e a estética do ambiente. Primeiramente, as placas danificadas devem ser removidas com cuidado, avaliando o estado do substrato para assegurar que não haja danos adicionais na base. Em seguida, novas placas de piso devem ser instaladas, com atenção à escolha de materiais adequados ao local (externo), considerando resistência e durabilidade. O rejunte deve ser aplicado corretamente entre as placas, utilizando um produto de qualidade que ajude a selar e proteger o piso de infiltrações. Para prevenir o desgaste futuro, é recomendado aplicar uma camada de impermeabilizante, especialmente em áreas expostas a variações climáticas, para prolongar a vida útil do revestimento."
Mapa da patologia,"ELÉTRICA: Passagem de conduites, sem altura de proteção, contrachoques físicos."
Solução recomendada,"ELÉTRICA: Os conduítes devem ser reposicionados ou protegidos adequadamente, mantendo uma altura mínima de acordo com as normas de segurança, evitando o risco de danos acidentais e assegurando o livre acesso para manutenção e inspeção. Caso os conduítes já estejam instalados em locais vulneráveis a impactos, recomenda-se a instalação de proteções adicionais, como canaletas ou dutos metálicos, que possam minimizar o risco de danos físicos."
Mapa da patologia,"INCÊNDIO: Registro de recalque, na direção de saída de veículos e sem adaptador 2.1/2” e sem pintura de bordas nas cores vermelho para a tampa e amarelo a borda ao redor."
Solução recomendada,"INCÊNDIO: O registro de recalque, deve ser remanejado para fora da passagem de veículos. Instalar o adaptador de 2 1/2"". A tampa do registro deve ser pintada de vermelho e a borda e o corpo do registro em amarelo, conforme as normas de sinalização, para garantir visibilidade e facilitar a identificação em emergências."
Mapa da patologia,LIMPEZA: Caixa suja e com limosidade.
Solução recomendada,"LIMPEZA: Fazer a limpeza, desinfecção e impermeabilização do reservatório."
Mapa da patologia,"ESTRUTURA: Pilares com trincas e laje com ferragens expostas em processo de corrosão acelerada e trinca em diagonal, indicando recalque."
Solução recomendada,"ESTRUTURA: Fazer a avaliação de atividade e passividade das trincas e a correção das 
estruturas"
Mapa da patologia,ESTRUTURA: Desplacamento de revestimentos de concreto em laje
Solução recomendada,ESTRUTURA: Fazer tratamento estrutural conforme anexo.
Mapa da patologia,"ALVENARIA: Desplacamento entre pilar e alvenaria, indicando ausência de amarração."
Solução recomendada,"ALVENARIA: Aplicar reforços, como a introdução de armaduras de ligação entre o pilar e a alvenaria, utilizando vergalhões ou outros sistemas de ancoragem adequados. O concreto ao redor da área afetada deve ser reparado, garantindo a aderência correta entre os elementos estruturais."
,LIMPEZA: Objetos estranhos ao centro de medição.
Solução recomendada,"LIMPEZA: Remover qualquer objeto estranho imediatamente, garantindo que o espaço esteja livre de obstruções e que o centro de medição tenha acesso adequado para manutenção e leitura dos medidores."
Mapa da patologia,"ELÉTRICA: Maioria dos disjuntores, antigos NEMA e unipolar em circuito 220V. LIMPEZA: Objetos estranhos ao centro de medição."
Solução recomendada,"ELÉTRICA: Substituir disjuntores, adequados à norma técnica vigente, preferencialmente 
bipolares, para garantir maior segurança e proteção contra sobrecargas e curtos
circuitos. Revisar quadro de distribuição, adaptando-o ao padrão atual dimensionado 
corretamente para as necessidades do sistema elétrico. Fixar luminárias, prevenindo 
riscos de quedas e curtos-circuitos. "
Mapa da patologia,MURO: Excesso de sujeira e limosidade e desplacamento de cerâmicas.
Solução recomendada,"MURO: Limpar o muro com produtos anti-mofos e desinfetantes, remover cerâmicas desplacadas e verificar o substrato, reparando-o se necessário. Tratar a origem da umidade, aplicar impermeabilizante."
Mapa da patologia,"ESTRUTURA: Proteção de capa de muro quebrada e trinca ao longo da vertical, indicando, possível ausência de amarração de muro."
Solução recomendada,"ESTRUTURA: Aplicar reforços, como a introdução de armaduras de ligação entre o pilar e a alvenaria, utilizando vergalhões ou outros sistemas de ancoragem adequados. O concreto ao redor da área afetada deve ser reparado, garantindo a aderência correta entre os elementos estruturais"
Mapa da patologia,"ESTRUTURA: Trincas em muro dos fundos, possível assentamento da estrutura."
Solução recomendada,"ESTRUTURA: Fazer a avaliação de atividade e passividade das trincas e a correção das estruturas, conforme anexo. As trincas no muro indicam possível assentamento da estrutura devido a problemas no solo ou na fundação. É necessário avaliar as causas, como umidade ou drenagem, e estabilizar a fundação com reforços estruturais, como estacas ou pilares. As trincas devem ser reparadas e as causas subjacentes tratadas para prevenir novos danos."
Mapa da patologia,"REVESTIMENTOS: Desplacamento, de placas cerâmicas com risco de queda iminente. "
Solução recomendada,"REVESTIMENTOS: Isolar a área de risco devido ao desplacamento de cerâmicas, remover as placas soltas, verificar e preparar o substrato, e instalar novas placas com adesivo adequado. Identificar e corrigir a causa do desplacamento para evitar recorrência"
Mapa da patologia,"REVESTIMENTOS: Desplacamento, de placas cerâmicas com risco de queda iminente."
Solução recomendada,"REVESTIMENTOS: Isolar a área de risco devido ao desplacamento de cerâmicas, remover as placas soltas, verificar e preparar o substrato, e instalar novas placas com adesivo adequado. Identificar e corrigir a causa do desplacamento para evitar recorrência"
Mapa da patologia,"SPDA: Placas cerâmicas quebradas, devido remoção de estrutura antiga de SPDA."
Solução recomendada,SPDA: Remover resquícios de ferros e fazer fechamento com cerâmica e proceder com rejuntamento e limpeza.
Mapa da patologia,"SPDA: Placas cerâmicas quebradas, devido remoção de estrutura antiga de SPDA. Ausência de aterramento de estruturas metálicas, como toldos e antenas."
Solução recomendada,SPDA: Remover resquícios de ferros e fazer fechamento com cerâmica e proceder com rejuntamento e limpeza e aterrar antenas e toldos com estrutura metálica
Mapa da patologia,SPDA: Ausência de anel equipotencial em todo o perímetro do telhado.
Solução recomendada,SPDA: Instalar anel equipotencial em muretas.
Mapa da patologia,Hidráulica: Identificação de prumadas.
Solução recomendada,"Hidráulica: Manter a lista sempre em bom estado, para identificação."
Mapa da patologia,"Hidráulica: Tubulação de ventilação de esgoto, interna a casa de máquinas."
Solução recomendada,"Hidráulica: Fazer fechamento de tubulação por dentro da casa de máquinas, para 
evitar a infiltração de gases tóxicos. "
